{"edges":[{"evidence_class":"chio-sidecar-proof","from":"provider-discovery-snapshot","predicate":"binds","to":"provider-selection-report"},{"evidence_class":"chio-sidecar-proof","from":"provider-selection-report","predicate":"binds","to":"sla-commitment"},{"evidence_class":"chio-sidecar-proof","from":"provider-selection-report","predicate":"binds","to":"risk-comptroller-report"},{"evidence_class":"digest-bound-reference","from":"trust-scorecard-snapshot","predicate":"derives","to":"reputation-import-report"},{"evidence_class":"chio-sidecar-proof","from":"guarantee-decision","predicate":"binds","to":"collateral-position-report"},{"evidence_class":"chio-sidecar-proof","from":"guarantee-decision","predicate":"binds","to":"adjudication-jurisdiction-receipt"},{"evidence_class":"digest-bound-reference","from":"claim-set","predicate":"binds","to":"verifier-policy"}],"id":"evidence-graph-trust-market-valid","issued_at":"2026-06-10T00:00:00Z","nodes":[{"id":"provider-discovery-snapshot","path":"provider-discovery-snapshot.json","role":"provider-discovery-snapshot","schema":"chio.commerce.provider-discovery-snapshot.v1","sha256":"d1a4b7aed0daf6aeeca885893e7114b1f8f5eff2c847f2003a0600fa48d8adf1"},{"id":"trust-scorecard-snapshot","path":"trust-scorecard-snapshot.json","role":"trust-scorecard-snapshot","schema":"chio.trust.scorecard-snapshot.v1","sha256":"2b803de8f1fa734a89ed203feb107e27d970a06113b29c1e684459f83f32739b"},{"id":"reputation-import-report","path":"reputation-import-report.json","role":"reputation-import-report","schema":"chio.trust.reputation-import-report.v1","sha256":"1fe813e273a1f3b0729f47f520cba4b50835e0219ed6fa063b76ce3c219c890a"},{"id":"sla-commitment","path":"sla-commitment.json","role":"sla-commitment","schema":"chio.commerce.sla-commitment.v1","sha256":"429b48f0d8b7aa712b084aa00c3370ef52a8b3d92ef82c57ca01c2b893f0493b"},{"id":"sla-performance-report","path":"sla-performance-report.json","role":"sla-performance-report","schema":"chio.commerce.sla-performance-report.v1","sha256":"ccce20ab6e8cea3d7c5bc3fcb20048b89b1e454a0350a46c78d76d8e6a4d7d6d"},{"id":"risk-comptroller-report","path":"risk-comptroller-report.json","role":"risk-comptroller-report","schema":"chio.risk.comptroller-report.v1","sha256":"10ddfb3848389aa935d357058164f7822204e20a92586605853bbc23443f5c90"},{"id":"collateral-position-report","path":"collateral-position-report.json","role":"collateral-position-report","schema":"chio.risk.collateral-position-report.v1","sha256":"7184f2c317581a7f0058cded0551d534dc23314222b970884104ab695a39dc67"},{"id":"guarantee-decision","path":"guarantee-decision.json","role":"guarantee-decision","schema":"chio.risk.guarantee-decision.v1","sha256":"a89fc5b517798d60c3cce6437b6c4ac0dedbead5f688b5a07c8b3126d76ffd79"},{"id":"adjudication-jurisdiction-receipt","path":"adjudication-jurisdiction-receipt.json","role":"adjudication-jurisdiction-receipt","schema":"chio.risk.adjudication-jurisdiction-receipt.v1","sha256":"9f89790898b7f3f0a3c8c2fa30a100c50a84997eec7a0640f162a499fc3c38e8"},{"id":"provider-selection-report","path":"provider-selection-report.json","role":"provider-selection-report","schema":"chio.commerce.provider-selection-report.v1","sha256":"b57746cc4feeaf3c3cd21c955214bd57aa269dc3ed0d1f2c61b3ae8e6b4124eb"},{"id":"claim-set","path":"claim-set.json","role":"claim-set","schema":"chio.transaction.claim-set.v1","sha256":"dbc371b913d40ad77760ea1f12d2e1123264777c6209002c006d91f7232d9112"},{"id":"verifier-policy","path":"verifier-policy.json","role":"verifier-policy","schema":"chio.transaction.verifier-policy.v1","sha256":"c60f7977f24fde2152a36237485796dc6d5efcfdfb2de0cecee712f4ffaa3c5c"}],"schema":"chio.transaction.evidence-graph.v1"}
