{"edges":[{"evidence_class":"digest-bound-reference","from":"data-governance-report","predicate":"binds","to":"risk-comptroller-report"},{"evidence_class":"digest-bound-reference","from":"telemetry-projection","predicate":"projects-to","to":"risk-comptroller-report"},{"evidence_class":"digest-bound-reference","from":"control-evidence-map","predicate":"reconciles","to":"data-governance-report"},{"evidence_class":"chio-sidecar-proof","from":"evidence-export-bundle","predicate":"authorizes","to":"approval-case"},{"evidence_class":"digest-bound-reference","from":"claim-set","predicate":"binds","to":"verifier-policy"}],"id":"enterprise-evidence-graph-valid","issued_at":"2026-06-10T00:00:00Z","nodes":[{"id":"risk-comptroller-report","path":"risk-comptroller-report.json","role":"risk-comptroller-report","schema":"chio.risk.comptroller-report.v1","sha256":"61ad6b773876fb8baea5a947f558c7148c0afbf6c2b176507b4d70cd0d261ab4"},{"id":"data-governance-report","path":"data-governance-report.json","role":"data-governance-report","schema":"chio.enterprise.data-governance-report.v1","sha256":"c2f94c5995b13409b3712e9ab62b53decef273324a244c4e3d3efaa66e751ef5"},{"id":"approval-case","path":"approval-case.json","role":"approval-case","schema":"chio.enterprise.approval-case.v1","sha256":"08db32153fd4e6b308ee3d884a597e87d3785476dc0980109539648af4892f17"},{"id":"evidence-export-bundle","path":"evidence-export-bundle.json","role":"evidence-export-bundle","schema":"chio.enterprise.evidence-export-bundle.v1","sha256":"50b9ef09922bc7b48d94add81614c631e70d1ab64d70f691083e368ccf6766c9"},{"id":"telemetry-projection","path":"telemetry-projection.json","role":"telemetry-projection","schema":"chio.enterprise.telemetry-projection.v1","sha256":"2abd431c1f4042f4423e5f3089cb639f62ca3664b8adfb0e0e604c709e5a144a"},{"id":"control-evidence-map","path":"control-evidence-map.json","role":"control-evidence-map","schema":"chio.enterprise.control-evidence-map.v1","sha256":"68ff7b8c3c3503c2c2973fe7a6f07b87d507e29c3f3d9fdf8d609bbad7cb04da"},{"id":"claim-set","path":"claim-set.json","role":"claim-set","schema":"chio.transaction.claim-set.v1","sha256":"736a8efee3228566c2fcb351dfa8083b126ca5c7534d566316632e22dbfeb647"},{"id":"verifier-policy","path":"verifier-policy.json","role":"verifier-policy","schema":"chio.transaction.verifier-policy.v1","sha256":"7c51bd2927842c58755b94310c22390953bbd5cf9e483170b035f76e1ce7695b"}],"schema":"chio.transaction.evidence-graph.v1"}
