{"edges":[{"evidence_class":"digest-bound-reference","from":"c2f94c5995b13409b3712e9ab62b53decef273324a244c4e3d3efaa66e751ef5","predicate":"binds","to":"c7888059b10cb51b68c420fb318fc97f1655cc019b53d08528b2763f2f931693"},{"evidence_class":"digest-bound-reference","from":"d081518409ae8d9fac6f69f7091f367fc288aabbe51f94e1edb4fd6111de68b0","predicate":"projects-to","to":"c7888059b10cb51b68c420fb318fc97f1655cc019b53d08528b2763f2f931693"},{"evidence_class":"digest-bound-reference","from":"68ff7b8c3c3503c2c2973fe7a6f07b87d507e29c3f3d9fdf8d609bbad7cb04da","predicate":"reconciles","to":"c2f94c5995b13409b3712e9ab62b53decef273324a244c4e3d3efaa66e751ef5"},{"evidence_class":"chio-sidecar-proof","from":"e17ab0768eadb9c85631395cd889d160fee0ebf43ea0687706ccbad039a1fb57","predicate":"authorizes","to":"d0051273233d0f3cc087f34f3908b0b81ec077329f1b6b162be86d54b98e0dee"},{"evidence_class":"digest-bound-reference","from":"736a8efee3228566c2fcb351dfa8083b126ca5c7534d566316632e22dbfeb647","predicate":"binds","to":"7c51bd2927842c58755b94310c22390953bbd5cf9e483170b035f76e1ce7695b"}],"id":"enterprise-evidence-graph-valid","issued_at":"2026-06-10T00:00:00Z","nodes":[{"id":"c7888059b10cb51b68c420fb318fc97f1655cc019b53d08528b2763f2f931693","path":"risk-comptroller-report.json","role":"risk-comptroller-report","schema":"chio.risk.comptroller-report.v1","sha256":"c7888059b10cb51b68c420fb318fc97f1655cc019b53d08528b2763f2f931693"},{"id":"c2f94c5995b13409b3712e9ab62b53decef273324a244c4e3d3efaa66e751ef5","path":"data-governance-report.json","role":"data-governance-report","schema":"chio.enterprise.data-governance-report.v1","sha256":"c2f94c5995b13409b3712e9ab62b53decef273324a244c4e3d3efaa66e751ef5"},{"id":"d0051273233d0f3cc087f34f3908b0b81ec077329f1b6b162be86d54b98e0dee","path":"approval-case.json","role":"approval-case","schema":"chio.enterprise.approval-case.v1","sha256":"d0051273233d0f3cc087f34f3908b0b81ec077329f1b6b162be86d54b98e0dee"},{"id":"e17ab0768eadb9c85631395cd889d160fee0ebf43ea0687706ccbad039a1fb57","path":"evidence-export-bundle.json","role":"evidence-export-bundle","schema":"chio.enterprise.evidence-export-bundle.v1","sha256":"e17ab0768eadb9c85631395cd889d160fee0ebf43ea0687706ccbad039a1fb57"},{"id":"d081518409ae8d9fac6f69f7091f367fc288aabbe51f94e1edb4fd6111de68b0","path":"telemetry-projection.json","role":"telemetry-projection","schema":"chio.enterprise.telemetry-projection.v1","sha256":"d081518409ae8d9fac6f69f7091f367fc288aabbe51f94e1edb4fd6111de68b0"},{"id":"68ff7b8c3c3503c2c2973fe7a6f07b87d507e29c3f3d9fdf8d609bbad7cb04da","path":"control-evidence-map.json","role":"control-evidence-map","schema":"chio.enterprise.control-evidence-map.v1","sha256":"68ff7b8c3c3503c2c2973fe7a6f07b87d507e29c3f3d9fdf8d609bbad7cb04da"},{"id":"736a8efee3228566c2fcb351dfa8083b126ca5c7534d566316632e22dbfeb647","path":"claim-set.json","role":"claim-set","schema":"chio.transaction.claim-set.v1","sha256":"736a8efee3228566c2fcb351dfa8083b126ca5c7534d566316632e22dbfeb647"},{"id":"7c51bd2927842c58755b94310c22390953bbd5cf9e483170b035f76e1ce7695b","path":"verifier-policy.json","role":"verifier-policy","schema":"chio.transaction.verifier-policy.v1","sha256":"7c51bd2927842c58755b94310c22390953bbd5cf9e483170b035f76e1ce7695b"}],"schema":"chio.transaction.evidence-graph.v1"}
