{"edges":[{"evidence_class":"chio-sidecar-proof","from":"standard-webhooks-envelope","predicate":"projects-to","to":"standard-webhooks-manifest"},{"evidence_class":"digest-bound-reference","from":"standard-webhooks-envelope","predicate":"binds","to":"webhook-delivery"},{"evidence_class":"chio-sidecar-proof","from":"cloudevents-envelope","predicate":"projects-to","to":"cloudevents-manifest"},{"evidence_class":"digest-bound-reference","from":"cloudevents-envelope","predicate":"binds","to":"cloudevents-event"},{"evidence_class":"chio-sidecar-proof","from":"graphql-http-envelope","predicate":"projects-to","to":"graphql-http-manifest"},{"evidence_class":"digest-bound-reference","from":"graphql-http-envelope","predicate":"binds","to":"graphql-operation"},{"evidence_class":"chio-sidecar-proof","from":"mcp-envelope","predicate":"projects-to","to":"mcp-manifest"},{"evidence_class":"digest-bound-reference","from":"mcp-envelope","predicate":"binds","to":"mcp-tool-call"},{"evidence_class":"digest-bound-reference","from":"standard-webhooks-envelope","predicate":"binds","to":"receipt-agent-web-webhook-allow"},{"evidence_class":"digest-bound-reference","from":"cloudevents-envelope","predicate":"binds","to":"receipt-agent-web-cloudevents-allow"},{"evidence_class":"digest-bound-reference","from":"graphql-http-envelope","predicate":"binds","to":"receipt-agent-web-graphql-mutation-allow"},{"evidence_class":"digest-bound-reference","from":"mcp-envelope","predicate":"binds","to":"receipt-agent-web-mcp-tool-call-allow"},{"evidence_class":"chio-sidecar-proof","from":"a2a-envelope","predicate":"projects-to","to":"a2a-manifest"},{"evidence_class":"digest-bound-reference","from":"a2a-envelope","predicate":"binds","to":"a2a-task"},{"evidence_class":"digest-bound-reference","from":"a2a-envelope","predicate":"binds","to":"receipt-agent-web-a2a-task-allow"},{"evidence_class":"digest-bound-reference","from":"claim-set","predicate":"binds","to":"verifier-policy"}],"id":"agent-web-evidence-graph-valid","issued_at":"2026-06-10T00:00:00Z","nodes":[{"id":"webhook-delivery","path":"external/webhook-delivery.json","role":"external-subject","schema":"external.standard-webhooks.delivery.v1","sha256":"48eaef76fa76e8a9ea9d56deda61aa3975ddd34c3c7c5a7119e7b8c606a78af8"},{"id":"cloudevents-event","path":"external/cloudevent.json","role":"external-subject","schema":"external.cloudevents.event.v1","sha256":"f08fd81f62cf6b65012a375ddaf38eb1a75a27bb5d9f1e8938bf039de1b19c4b"},{"id":"graphql-operation","path":"external/graphql-operation.json","role":"external-subject","schema":"external.graphql-http.operation.v1","sha256":"d7414c726c2dbe57d924830f051acafb66e93ed306a303973881933a88f4b3ea"},{"id":"mcp-tool-call","path":"external/mcp-tool-call.json","role":"external-subject","schema":"external.mcp.tool-call.v1","sha256":"d91d74b44948a99bde89aac37a2caf720c88026c337a2f5e3be2a759a5d2c117"},{"id":"standard-webhooks-manifest","path":"standard-webhooks-manifest.json","role":"external-projection-manifest","schema":"chio.agent-web.external-projection-manifest.v1","sha256":"6ae1fa3c74b902676a563dd62aa6f3950aa9915696cf274a6a570d39a6296d4d"},{"id":"standard-webhooks-envelope","path":"standard-webhooks-envelope.json","role":"agent-web-proof-envelope","schema":"chio.agent-web-proof-envelope.v1","sha256":"172bdcf04cb8939293818e9382ba35bb9aab038bc65f66dee4878bdd6cad20ec"},{"id":"cloudevents-manifest","path":"cloudevents-manifest.json","role":"external-projection-manifest","schema":"chio.agent-web.external-projection-manifest.v1","sha256":"c30aed3ca09918003acfdcfa52ae755d22d86876e36a54937d8e2276651ff862"},{"id":"cloudevents-envelope","path":"cloudevents-envelope.json","role":"agent-web-proof-envelope","schema":"chio.agent-web-proof-envelope.v1","sha256":"51b8672de71dd309577159df05df1b53afa93239c02e1590ee124f42c733028d"},{"id":"graphql-http-manifest","path":"graphql-http-manifest.json","role":"external-projection-manifest","schema":"chio.agent-web.external-projection-manifest.v1","sha256":"9c81a7cd2a36fef4c7b9a6696051ebc128248faf2b7c4452a0efbab6890acf2c"},{"id":"graphql-http-envelope","path":"graphql-http-envelope.json","role":"agent-web-proof-envelope","schema":"chio.agent-web-proof-envelope.v1","sha256":"9f0b16a7e9a6fdad05bb440b8c526aa5a8282febfc0fb0b2df250165a3d5eed7"},{"id":"mcp-manifest","path":"mcp-manifest.json","role":"external-projection-manifest","schema":"chio.agent-web.external-projection-manifest.v1","sha256":"f48676d7c83cf9199e99cff4cfaa672a6a681c84967c5ad9aaf468783f75d5bd"},{"id":"mcp-envelope","path":"mcp-envelope.json","role":"agent-web-proof-envelope","schema":"chio.agent-web-proof-envelope.v1","sha256":"35415adec8da3285683eb22bd10c0ab387e4b3d374b5422f18f3c6d93590e6d1"},{"id":"receipt-agent-web-webhook-allow","path":"receipts/receipt-agent-web-webhook-allow.json","role":"receipt","schema":"chio.receipt.v1","sha256":"5ae1b4ee8cbccd565abf5d422f8032242a080047e6ca10d3cb81dfd78d7cf4ed"},{"id":"receipt-agent-web-cloudevents-allow","path":"receipts/receipt-agent-web-cloudevents-allow.json","role":"receipt","schema":"chio.receipt.v1","sha256":"dc792e2ed9edd8bb5c6b812d56777b6b34a15454bc22c6ee7db1b0230b37e306"},{"id":"receipt-agent-web-graphql-mutation-allow","path":"receipts/receipt-agent-web-graphql-mutation-allow.json","role":"receipt","schema":"chio.receipt.v1","sha256":"6058831b3e4bf8da6f92107b9215d20bd427ae1bd44ac35d9f0cfc8fcaca10dd"},{"id":"receipt-agent-web-mcp-tool-call-allow","path":"receipts/receipt-agent-web-mcp-tool-call-allow.json","role":"receipt","schema":"chio.receipt.v1","sha256":"cddfc042b592915225914fcf93b029fa21217997fcba933f8baf8b874c611319"},{"id":"a2a-task","path":"external/a2a-task.json","role":"external-subject","schema":"external.a2a.task.v1","sha256":"5b8c5444e0315f114cec7960b7fd3aa7e8cb6cd895c98bb9a7e355b713bee822"},{"id":"a2a-manifest","path":"a2a-manifest.json","role":"external-projection-manifest","schema":"chio.agent-web.external-projection-manifest.v1","sha256":"e770fa89dfb68c6bcf7d79d35c0f61a6c6de36460a0b9c57c0a93d6cf9d77bdb"},{"id":"a2a-envelope","path":"a2a-envelope.json","role":"agent-web-proof-envelope","schema":"chio.agent-web-proof-envelope.v1","sha256":"bdd590f067f211ad650d20500f9b381ada62d21a181b7bf7025a8a0351ad79c6"},{"id":"receipt-agent-web-a2a-task-allow","path":"receipts/receipt-agent-web-a2a-task-allow.json","role":"receipt","schema":"chio.receipt.v1","sha256":"10157dc3589ef82d443fbeadb104b7763f075b25aed389d71622ffd2b381b97f"},{"id":"claim-set","path":"claim-set.json","role":"claim-set","schema":"chio.transaction.claim-set.v1","sha256":"e9e23c84fb46f8dca94e7bdb0de6a1546202c89c16d5462b4f4ea755ca44a61f"},{"id":"verifier-policy","path":"verifier-policy.json","role":"verifier-policy","schema":"chio.transaction.verifier-policy.v1","sha256":"1a267f15367cb2e191ad9bb7e2c89d3ef154eb8e6978676f9df5566e4d836bdb"}],"schema":"chio.transaction.evidence-graph.v1"}