{"edges":[{"evidence_class":"digest-bound-reference","from":"order-context","predicate":"binds","to":"event-log"},{"evidence_class":"digest-bound-reference","from":"order-context","predicate":"binds","to":"payment-lifecycle"},{"evidence_class":"digest-bound-reference","from":"order-context","predicate":"binds","to":"mandate-allowance-ledger"}],"id":"evidence-graph-commerce-offline-psp-valid","issued_at":"2026-06-10T00:08:00Z","nodes":[{"id":"order-context","path":"order-context.json","role":"commerce-order-context","schema":"chio.commerce.order-context.v1","sha256":"a42aecfaf89a59775f8cc44b742155a1379473f5fe173549d37e5bc320759eb2"},{"id":"event-log","path":"event-log.json","role":"commerce-event-log","schema":"chio.commerce.event-log.v1","sha256":"6b636983f491863cbce135c788ee45d4e87a34733f35b51ba3ae686b42b1ac74"},{"id":"payment-lifecycle","path":"payment-lifecycle.json","role":"commerce-payment-lifecycle","schema":"chio.commerce.payment-lifecycle.v1","sha256":"4fa23c1184d67bea093cc62d549bea5cb02d9d246bd03f754f20d088ac5e8b35"},{"id":"mandate-allowance-ledger","path":"mandate-allowance-ledger.json","role":"commerce-mandate-allowance-ledger","schema":"chio.commerce.mandate-allowance-ledger.v1","sha256":"0d27312f1eeaf2f627dea12e5cc6bdc92cb6b5db80a073a5f97ab4c0326b6ad3"},{"id":"public-settlement-proof-bundle","path":"settlement-proof-bundle.json","role":"public-settlement-proof-bundle","schema":"chio.web3-settlement-proof-bundle.v1","sha256":"3ae2aa815a35f854ee1113da04b0703db90922039ae5f7c3294dc9784b6d2ccf"}],"schema":"chio.transaction.evidence-graph.v1"}
