{"schema":"chio.transaction.evidence-graph.v1","id":"evidence-public-settlement-valid","issued_at":"2026-06-10T00:00:00Z","nodes":[{"id":"public-settlement-proof-bundle","schema":"chio.web3-settlement-proof-bundle.v1","path":"settlement-proof-bundle.json","sha256":"fb7790f142199a915cc1f002e368ee4979c301c8d5186eccf52cd5e1a1cc01d7","role":"public-settlement-proof-bundle"},{"id":"verifier-policy","schema":"chio.transaction.verifier-policy.v1","path":"verifier-policy.json","sha256":"d4112c83e18c779e8c260430aeba1a8f4766043ba88e2f802fa5f11af23ab320","role":"verifier-policy"}],"edges":[{"from":"public-settlement-proof-bundle","to":"verifier-policy","predicate":"binds"}]}