{"edges":[{"evidence_class":"digest-bound-reference","from":"c2f94c5995b13409b3712e9ab62b53decef273324a244c4e3d3efaa66e751ef5","predicate":"binds","to":"25b898b813cb7ca9000e7788c79ac96fc39a102777f1c225d9e571f837b732b4"},{"evidence_class":"digest-bound-reference","from":"45e47e75f2442a5c81b57e8b8897b70f2227aac044026c99be4270a8585ca849","predicate":"projects-to","to":"25b898b813cb7ca9000e7788c79ac96fc39a102777f1c225d9e571f837b732b4"},{"evidence_class":"digest-bound-reference","from":"68ff7b8c3c3503c2c2973fe7a6f07b87d507e29c3f3d9fdf8d609bbad7cb04da","predicate":"reconciles","to":"c2f94c5995b13409b3712e9ab62b53decef273324a244c4e3d3efaa66e751ef5"},{"evidence_class":"chio-sidecar-proof","from":"88b625727501319a5d505b15ba69d87484528f56856ee975cd85a15e9f637704","predicate":"authorizes","to":"afe6575abb3e879ff4d805b0c8bdfc9d716d7cfc5b2a741f2d134b37b5acd058"},{"evidence_class":"digest-bound-reference","from":"736a8efee3228566c2fcb351dfa8083b126ca5c7534d566316632e22dbfeb647","predicate":"binds","to":"7c51bd2927842c58755b94310c22390953bbd5cf9e483170b035f76e1ce7695b"}],"id":"enterprise-evidence-graph-valid","issued_at":"2026-06-10T00:00:00Z","nodes":[{"id":"25b898b813cb7ca9000e7788c79ac96fc39a102777f1c225d9e571f837b732b4","path":"risk-comptroller-report.json","role":"risk-comptroller-report","schema":"chio.risk.comptroller-report.v1","sha256":"25b898b813cb7ca9000e7788c79ac96fc39a102777f1c225d9e571f837b732b4"},{"id":"c2f94c5995b13409b3712e9ab62b53decef273324a244c4e3d3efaa66e751ef5","path":"data-governance-report.json","role":"data-governance-report","schema":"chio.enterprise.data-governance-report.v1","sha256":"c2f94c5995b13409b3712e9ab62b53decef273324a244c4e3d3efaa66e751ef5"},{"id":"afe6575abb3e879ff4d805b0c8bdfc9d716d7cfc5b2a741f2d134b37b5acd058","path":"approval-case.json","role":"approval-case","schema":"chio.enterprise.approval-case.v1","sha256":"afe6575abb3e879ff4d805b0c8bdfc9d716d7cfc5b2a741f2d134b37b5acd058"},{"id":"88b625727501319a5d505b15ba69d87484528f56856ee975cd85a15e9f637704","path":"evidence-export-bundle.json","role":"evidence-export-bundle","schema":"chio.enterprise.evidence-export-bundle.v1","sha256":"88b625727501319a5d505b15ba69d87484528f56856ee975cd85a15e9f637704"},{"id":"45e47e75f2442a5c81b57e8b8897b70f2227aac044026c99be4270a8585ca849","path":"telemetry-projection.json","role":"telemetry-projection","schema":"chio.enterprise.telemetry-projection.v1","sha256":"45e47e75f2442a5c81b57e8b8897b70f2227aac044026c99be4270a8585ca849"},{"id":"68ff7b8c3c3503c2c2973fe7a6f07b87d507e29c3f3d9fdf8d609bbad7cb04da","path":"control-evidence-map.json","role":"control-evidence-map","schema":"chio.enterprise.control-evidence-map.v1","sha256":"68ff7b8c3c3503c2c2973fe7a6f07b87d507e29c3f3d9fdf8d609bbad7cb04da"},{"id":"736a8efee3228566c2fcb351dfa8083b126ca5c7534d566316632e22dbfeb647","path":"claim-set.json","role":"claim-set","schema":"chio.transaction.claim-set.v1","sha256":"736a8efee3228566c2fcb351dfa8083b126ca5c7534d566316632e22dbfeb647"},{"id":"7c51bd2927842c58755b94310c22390953bbd5cf9e483170b035f76e1ce7695b","path":"verifier-policy.json","role":"verifier-policy","schema":"chio.transaction.verifier-policy.v1","sha256":"7c51bd2927842c58755b94310c22390953bbd5cf9e483170b035f76e1ce7695b"}],"schema":"chio.transaction.evidence-graph.v1"}
