{"edges":[{"evidence_class":"digest-bound-reference","from":"c2f94c5995b13409b3712e9ab62b53decef273324a244c4e3d3efaa66e751ef5","predicate":"binds","to":"d76f920d26682d165b9decc38c62f6f33ab9066d0272a536ec6243c4d8a925ae"},{"evidence_class":"digest-bound-reference","from":"23026e25fab81de057cf4674cfef8885895aa2d2a01b5f7dc18967ba5483701c","predicate":"projects-to","to":"d76f920d26682d165b9decc38c62f6f33ab9066d0272a536ec6243c4d8a925ae"},{"evidence_class":"digest-bound-reference","from":"68ff7b8c3c3503c2c2973fe7a6f07b87d507e29c3f3d9fdf8d609bbad7cb04da","predicate":"reconciles","to":"c2f94c5995b13409b3712e9ab62b53decef273324a244c4e3d3efaa66e751ef5"},{"evidence_class":"chio-sidecar-proof","from":"0de662e4a297d649a9daf0f8aaab0db7654962fdccf15ad4e3e98e868aa16393","predicate":"authorizes","to":"98655d09cded0ae368aaccf59b0d7ddf66460ea5cae76b3ce71f2fef9edf85f0"},{"evidence_class":"digest-bound-reference","from":"736a8efee3228566c2fcb351dfa8083b126ca5c7534d566316632e22dbfeb647","predicate":"binds","to":"7c51bd2927842c58755b94310c22390953bbd5cf9e483170b035f76e1ce7695b"}],"id":"enterprise-evidence-graph-valid","issued_at":"2026-06-10T00:00:00Z","nodes":[{"id":"d76f920d26682d165b9decc38c62f6f33ab9066d0272a536ec6243c4d8a925ae","path":"risk-comptroller-report.json","role":"risk-comptroller-report","schema":"chio.risk.comptroller-report.v1","sha256":"d76f920d26682d165b9decc38c62f6f33ab9066d0272a536ec6243c4d8a925ae"},{"id":"c2f94c5995b13409b3712e9ab62b53decef273324a244c4e3d3efaa66e751ef5","path":"data-governance-report.json","role":"data-governance-report","schema":"chio.enterprise.data-governance-report.v1","sha256":"c2f94c5995b13409b3712e9ab62b53decef273324a244c4e3d3efaa66e751ef5"},{"id":"98655d09cded0ae368aaccf59b0d7ddf66460ea5cae76b3ce71f2fef9edf85f0","path":"approval-case.json","role":"approval-case","schema":"chio.enterprise.approval-case.v1","sha256":"98655d09cded0ae368aaccf59b0d7ddf66460ea5cae76b3ce71f2fef9edf85f0"},{"id":"0de662e4a297d649a9daf0f8aaab0db7654962fdccf15ad4e3e98e868aa16393","path":"evidence-export-bundle.json","role":"evidence-export-bundle","schema":"chio.enterprise.evidence-export-bundle.v1","sha256":"0de662e4a297d649a9daf0f8aaab0db7654962fdccf15ad4e3e98e868aa16393"},{"id":"23026e25fab81de057cf4674cfef8885895aa2d2a01b5f7dc18967ba5483701c","path":"telemetry-projection.json","role":"telemetry-projection","schema":"chio.enterprise.telemetry-projection.v1","sha256":"23026e25fab81de057cf4674cfef8885895aa2d2a01b5f7dc18967ba5483701c"},{"id":"68ff7b8c3c3503c2c2973fe7a6f07b87d507e29c3f3d9fdf8d609bbad7cb04da","path":"control-evidence-map.json","role":"control-evidence-map","schema":"chio.enterprise.control-evidence-map.v1","sha256":"68ff7b8c3c3503c2c2973fe7a6f07b87d507e29c3f3d9fdf8d609bbad7cb04da"},{"id":"736a8efee3228566c2fcb351dfa8083b126ca5c7534d566316632e22dbfeb647","path":"claim-set.json","role":"claim-set","schema":"chio.transaction.claim-set.v1","sha256":"736a8efee3228566c2fcb351dfa8083b126ca5c7534d566316632e22dbfeb647"},{"id":"7c51bd2927842c58755b94310c22390953bbd5cf9e483170b035f76e1ce7695b","path":"verifier-policy.json","role":"verifier-policy","schema":"chio.transaction.verifier-policy.v1","sha256":"7c51bd2927842c58755b94310c22390953bbd5cf9e483170b035f76e1ce7695b"}],"schema":"chio.transaction.evidence-graph.v1"}
